{
  "version": 1,
  "id": "M00",
  "title": "Repository and Contracts Foundation",
  "status": "ACTIVE",
  "outcome": "The repository builds from a documented environment, generated contracts are reproducible, required checks run automatically, and coding agents can execute bounded work packages.",
  "non_goals": [
    "real cloud agent provider",
    "production UI feature set",
    "production memory retrieval"
  ],
  "owner_decisions": [
    "DEC-0001",
    "DEC-0002",
    "DEC-0003"
  ],
  "vertical_slices": [
    {
      "id": "VS-M00-00",
      "title": "Canonical repository identity",
      "work_packages": [
        "WP-M00-006"
      ]
    },
    {
      "id": "VS-M00-01",
      "title": "Reproducible repository verification",
      "work_packages": [
        "WP-M00-001",
        "WP-M00-002",
        "WP-M00-003",
        "WP-M00-007"
      ]
    },
    {
      "id": "VS-M00-02",
      "title": "Planning and quality gates",
      "work_packages": [
        "WP-M00-004",
        "WP-M00-005"
      ]
    }
  ],
  "work_packages": [
    {
      "version": 1,
      "id": "WP-M00-006",
      "title": "Normalize canonical product identity and license state",
      "status": "MERGED",
      "milestone": "M00",
      "vertical_slice": "VS-M00-00",
      "risk": "R2",
      "outcome": "All public names, code identifiers, protocol namespaces and repository metadata consistently use Dennett, and the repository contains no license file while the owner has not selected a license.",
      "non_goals": [
        "behavioral product changes",
        "repository rename on GitHub",
        "selecting an open-source or source-available license"
      ],
      "requirement_refs": [
        "OWNER:CanonicalNameDennett",
        "OWNER:NoLicenseSelected",
        "M00:OwnerGate"
      ],
      "architecture_refs": [
        "docs/implementation/04_MILESTONE_DEPENDENCY_MAP.md#3-m00--repository-and-contracts"
      ],
      "depends_on": [],
      "allowed_roots": [
        "AGENTS.md",
        "README.md",
        "README.ru.md",
        "docs",
        "apps",
        "crates",
        "services",
        "protocols",
        "tools",
        "planning",
        "schemas",
        "tests",
        "Cargo.toml",
        "package.json",
        "pyproject.toml",
        ".gitignore",
        ".env.example",
        "CONTRIBUTING.md",
        "ROADMAP.md",
        "REPOSITORY_MANIFEST.json",
        "REPOSITORY_CHECKSUMS.sha256"
      ],
      "forbidden_roots": [
        ".git"
      ],
      "state_ownership": {
        "reads": [
          "owner product identity decision"
        ],
        "writes": [
          "repository naming and public metadata"
        ]
      },
      "contract_changes": {
        "public_api": true,
        "protocol": true,
        "persistent_schema": false,
        "migration": false
      },
      "security_effects": {
        "permission_change": false,
        "external_effect": false,
        "secret_access": false
      },
      "acceptance": [
        "TEST-PRODUCT-IDENTITY-001"
      ],
      "required_commands": [
        "uv run python tools/verify_repo.py",
        "uv run python tools/verify_docs.py",
        "uv run python tools/generate_doc_index.py --check"
      ],
      "observability": [],
      "rollback": [
        "revert the identity-normalization commit before later public contracts depend on it"
      ],
      "owner_decision": {
        "required_before_start": false,
        "required_before_merge": false,
        "resolved_by": [
          "DEC-0001",
          "DEC-0002"
        ]
      },
      "estimate": {
        "target_agent_hours": 2,
        "max_diff_lines": 20000
      },
      "notes": [
        "This is intentionally broad mechanical work performed before implementation packages.",
        "The owner waived the detached R2 review in DEC-0003 after tenant policy blocked the approved external review; local automated checks and self-review passed."
      ]
    },
    {
      "version": 1,
      "id": "WP-M00-001",
      "title": "Establish reproducible bootstrap and Rust workspace baseline",
      "status": "MERGED",
      "milestone": "M00",
      "vertical_slice": "VS-M00-01",
      "risk": "R1",
      "outcome": "A clean checkout can install pinned development tools, synchronize Python dependencies with uv, install the frozen pnpm workspace, and pass Rust format, lint and workspace tests.",
      "non_goals": [
        "production packaging",
        "mobile native toolchains",
        "cloud credentials"
      ],
      "requirement_refs": [
        "ARCH-83:Bootstrap",
        "ARCH-83:Milestone0",
        "M00:CleanMachineBootstrap"
      ],
      "architecture_refs": [
        "docs/architecture/83_Dennett_Client_Operations_Testing_and_Implementation_Blueprint.md#77-bootstrap",
        "docs/architecture/83_Dennett_Client_Operations_Testing_and_Implementation_Blueprint.md#90-milestone-0--repository-and-contracts"
      ],
      "depends_on": [
        "WP-M00-006"
      ],
      "allowed_roots": [
        "tools",
        "pyproject.toml",
        "uv.lock",
        "mise.toml",
        "rust-toolchain.toml",
        "Cargo.toml",
        "Cargo.lock",
        "package.json",
        "pnpm-lock.yaml",
        "pnpm-workspace.yaml",
        "Justfile",
        ".gitignore",
        ".github",
        "README.md",
        "README.ru.md",
        "CONTRIBUTING.md",
        "VALIDATION.md",
        "REPOSITORY_CHECKSUMS.sha256",
        "REPOSITORY_MANIFEST.json",
        "planning",
        "tests",
        "crates",
        "services",
        "apps"
      ],
      "forbidden_roots": [
        "docs/specifications",
        "docs/architecture"
      ],
      "state_ownership": {
        "reads": [
          "repository manifests and workspace declarations"
        ],
        "writes": [
          "development toolchain and dependency locks"
        ]
      },
      "contract_changes": {
        "public_api": false,
        "protocol": false,
        "persistent_schema": false,
        "migration": false
      },
      "security_effects": {
        "permission_change": false,
        "external_effect": false,
        "secret_access": false
      },
      "acceptance": [
        "TEST-BOOTSTRAP-CLEAN-001",
        "TEST-RUST-WORKSPACE-001"
      ],
      "required_commands": [
        "just bootstrap",
        "just rust"
      ],
      "observability": [
        "doctor prints exact resolved tool versions"
      ],
      "rollback": [
        "revert lockfiles and toolchain pins together"
      ],
      "owner_decision": {
        "required_before_start": false,
        "required_before_merge": false
      },
      "estimate": {
        "target_agent_hours": 4,
        "max_diff_lines": 5000
      },
      "notes": [
        "Python dependency installation must use uv, never pip.",
        "Generated Cargo, pnpm and uv lockfiles account for most of the diff-line budget.",
        "Planning lifecycle records and generated repository metadata are package-completion artifacts."
      ]
    },
    {
      "version": 1,
      "id": "WP-M00-002",
      "title": "Generate and validate protocol clients",
      "status": "MERGED",
      "milestone": "M00",
      "vertical_slice": "VS-M00-01",
      "risk": "R2",
      "outcome": "Buf lint, formatting, pinned generation and breaking-change checks run reproducibly, and committed generated Rust and TypeScript clients are verified against canonical Protobuf sources.",
      "non_goals": [
        "production transport implementation",
        "new protocol semantics",
        "mobile bindings"
      ],
      "requirement_refs": [
        "ARCH-81:ProtocolPackages",
        "ARCH-83:GeneratedClients",
        "M00:ProtocolBreakingGate"
      ],
      "architecture_refs": [
        "docs/architecture/81_Dennett_Data_Memory_Storage_Sync_and_Protocol_Architecture.md#часть-ix-protocol-architecture",
        "docs/architecture/83_Dennett_Client_Operations_Testing_and_Implementation_Blueprint.md#90-milestone-0--repository-and-contracts"
      ],
      "depends_on": [
        "WP-M00-001"
      ],
      "allowed_roots": [
        "protocols",
        "generated",
        "tools",
        ".github",
        ".gitignore",
        ".gitattributes",
        "Justfile",
        "README.md",
        "README.ru.md",
        "CONTRIBUTING.md",
        "planning",
        "tests",
        "REPOSITORY_MANIFEST.json",
        "REPOSITORY_CHECKSUMS.sha256"
      ],
      "forbidden_roots": [
        "docs/specifications"
      ],
      "state_ownership": {
        "reads": [
          "canonical Protobuf schemas"
        ],
        "writes": [
          "generated protocol client artifacts"
        ]
      },
      "contract_changes": {
        "public_api": true,
        "protocol": true,
        "persistent_schema": false,
        "migration": false
      },
      "security_effects": {
        "permission_change": false,
        "external_effect": false,
        "secret_access": false
      },
      "acceptance": [
        "TEST-PROTOCOL-GENERATION-001",
        "TEST-PROTOCOL-BREAKING-001"
      ],
      "required_commands": [
        "just generate",
        "just test-contracts"
      ],
      "observability": [
        "generation check reports the exact stale artifact paths"
      ],
      "rollback": [
        "revert schema and generated outputs in the same commit"
      ],
      "owner_decision": {
        "required_before_start": false,
        "required_before_merge": false
      },
      "estimate": {
        "target_agent_hours": 4,
        "max_diff_lines": 4000
      },
      "notes": [
        "Planning lifecycle, test-catalogue evidence and generated repository metadata are package-completion artifacts.",